{
  "schemaVersion": "1.0.0",
  "benchmark": {
    "id": "research-capability-v1",
    "version": "1.0.0",
    "manifestHash": "3858e44b89848974543a7d07631ef9bbf020d9342d7b6bb8da7880d145a59cda"
  },
  "environment": {
    "coreVersion": "1.0.0",
    "publicSchemaVersion": "1.0.0",
    "implementationHash": "65d95d929dde51adf6a862e44aa7b1816ae4f32d3266bebdaa494347ed01eb3e",
    "repositoryHead": "ecd44999287e31241a3c9f0b4a2df9b9817ce084",
    "node": "v22.23.1",
    "platform": "linux",
    "arch": "x64",
    "model": null,
    "knownCostUsd": 0,
    "elapsedMs": 1132
  },
  "fixtureRootHash": "00319dd43fb002eaeb7d9c80202d5ecdfbe80f5303dc988c58d426c72e2f34f5",
  "dimensions": [
    {
      "id": "01-question-scope",
      "title": "问题与范围",
      "cases": [
        {
          "id": "d01-success",
          "kind": "success",
          "expectedOutcome": "demonstrated",
          "capabilityOutcome": "demonstrated",
          "gateResult": "pass",
          "reasonCode": "SCOPE_GATE_COMPLETE",
          "inputHash": "ff8d0f58b3b5ec5985bc50a53db3bad1b879632b08b32980b5faf695d0b0e600",
          "outputHash": "9b2f2b084d81ff4a6f2750508cc9fb78aed5ebf250bb99d540fec1374bd025d6",
          "artifactHashes": [],
          "publicOperations": [
            "project.create",
            "question.propose",
            "question.select",
            "scope.approve",
            "project.status"
          ],
          "humanReview": {
            "status": "pending",
            "rubric": "Review whether 问题与范围 is demonstrated with traceable evidence and an appropriate claim boundary.",
            "reviewer": null,
            "notes": null
          }
        },
        {
          "id": "d01-adversarial",
          "kind": "adversarial",
          "expectedOutcome": "rejected",
          "capabilityOutcome": "rejected",
          "gateResult": "pass",
          "reasonCode": "PREMATURE_SCOPE_REJECTED",
          "inputHash": "b042bd58eed488b5c47352dccfe4836b67b9ac2e8a23430a0d8d731e766e28c0",
          "outputHash": "2f29169c5088b107dea3d646daa131772d5c930dc7853c46130f3ee3a28209ae",
          "artifactHashes": [],
          "publicOperations": [
            "project.create",
            "scope.approve"
          ],
          "humanReview": {
            "status": "pending",
            "rubric": "Review whether 问题与范围 is demonstrated with traceable evidence and an appropriate claim boundary.",
            "reviewer": null,
            "notes": null
          }
        }
      ],
      "machineSummary": "demonstrated",
      "humanSummary": "pending"
    },
    {
      "id": "02-literature-evidence",
      "title": "文献检索与全文证据",
      "cases": [
        {
          "id": "d02-success",
          "kind": "success",
          "expectedOutcome": "not_evaluated",
          "capabilityOutcome": "not_evaluated",
          "gateResult": "not_evaluated",
          "reasonCode": "PUBLIC_CAPABILITY_UNAVAILABLE",
          "inputHash": "435cb5739a68e77f8cc86965a9b15e1b1a0f12875565422996ca4ca946cdf65f",
          "outputHash": "91e75f71c1966f8b205a7233267971356996c3a8f776668560c549dc3820d927",
          "artifactHashes": [],
          "publicOperations": [],
          "humanReview": {
            "status": "pending",
            "rubric": "Review whether 文献检索与全文证据 is demonstrated with traceable evidence and an appropriate claim boundary.",
            "reviewer": null,
            "notes": null
          }
        },
        {
          "id": "d02-adversarial",
          "kind": "adversarial",
          "expectedOutcome": "not_evaluated",
          "capabilityOutcome": "not_evaluated",
          "gateResult": "not_evaluated",
          "reasonCode": "PUBLIC_CAPABILITY_UNAVAILABLE",
          "inputHash": "842391d2ddefca45c8c08f5f2fe4010c56485f7dd294f79f5e4dfa50ab194c0f",
          "outputHash": "91e75f71c1966f8b205a7233267971356996c3a8f776668560c549dc3820d927",
          "artifactHashes": [],
          "publicOperations": [],
          "humanReview": {
            "status": "pending",
            "rubric": "Review whether 文献检索与全文证据 is demonstrated with traceable evidence and an appropriate claim boundary.",
            "reviewer": null,
            "notes": null
          }
        }
      ],
      "machineSummary": "not_evaluated",
      "humanSummary": "pending"
    },
    {
      "id": "03-novelty-boundary",
      "title": "创新性边界",
      "cases": [
        {
          "id": "d03-success",
          "kind": "success",
          "expectedOutcome": "not_evaluated",
          "capabilityOutcome": "not_evaluated",
          "gateResult": "not_evaluated",
          "reasonCode": "PUBLIC_CAPABILITY_UNAVAILABLE",
          "inputHash": "28ef6e4df135648a6d3d92c3b103f09579ba6de060f51efb231f6c20a2f6d988",
          "outputHash": "91e75f71c1966f8b205a7233267971356996c3a8f776668560c549dc3820d927",
          "artifactHashes": [],
          "publicOperations": [],
          "humanReview": {
            "status": "pending",
            "rubric": "Review whether 创新性边界 is demonstrated with traceable evidence and an appropriate claim boundary.",
            "reviewer": null,
            "notes": null
          }
        },
        {
          "id": "d03-adversarial",
          "kind": "adversarial",
          "expectedOutcome": "not_evaluated",
          "capabilityOutcome": "not_evaluated",
          "gateResult": "not_evaluated",
          "reasonCode": "PUBLIC_CAPABILITY_UNAVAILABLE",
          "inputHash": "96d59d9a637cdb5269299f4847c7bfbd24e06973c010210e6d43bed56fb03a4c",
          "outputHash": "91e75f71c1966f8b205a7233267971356996c3a8f776668560c549dc3820d927",
          "artifactHashes": [],
          "publicOperations": [],
          "humanReview": {
            "status": "pending",
            "rubric": "Review whether 创新性边界 is demonstrated with traceable evidence and an appropriate claim boundary.",
            "reviewer": null,
            "notes": null
          }
        }
      ],
      "machineSummary": "not_evaluated",
      "humanSummary": "pending"
    },
    {
      "id": "04-rival-hypotheses",
      "title": "竞争假设",
      "cases": [
        {
          "id": "d04-success",
          "kind": "success",
          "expectedOutcome": "not_evaluated",
          "capabilityOutcome": "not_evaluated",
          "gateResult": "not_evaluated",
          "reasonCode": "PUBLIC_CAPABILITY_UNAVAILABLE",
          "inputHash": "226573dcbacf9dc338727d7785c435b950827bfbad1ea895f08d3bd6384ada52",
          "outputHash": "91e75f71c1966f8b205a7233267971356996c3a8f776668560c549dc3820d927",
          "artifactHashes": [],
          "publicOperations": [],
          "humanReview": {
            "status": "pending",
            "rubric": "Review whether 竞争假设 is demonstrated with traceable evidence and an appropriate claim boundary.",
            "reviewer": null,
            "notes": null
          }
        },
        {
          "id": "d04-adversarial",
          "kind": "adversarial",
          "expectedOutcome": "not_evaluated",
          "capabilityOutcome": "not_evaluated",
          "gateResult": "not_evaluated",
          "reasonCode": "PUBLIC_CAPABILITY_UNAVAILABLE",
          "inputHash": "5768b544496ad7155aee223981e6ec5ec758a4eafb096eac9a934fbbc2a6f289",
          "outputHash": "91e75f71c1966f8b205a7233267971356996c3a8f776668560c549dc3820d927",
          "artifactHashes": [],
          "publicOperations": [],
          "humanReview": {
            "status": "pending",
            "rubric": "Review whether 竞争假设 is demonstrated with traceable evidence and an appropriate claim boundary.",
            "reviewer": null,
            "notes": null
          }
        }
      ],
      "machineSummary": "not_evaluated",
      "humanSummary": "pending"
    },
    {
      "id": "05-design-confounding",
      "title": "实验设计与混杂",
      "cases": [
        {
          "id": "d05-success",
          "kind": "success",
          "expectedOutcome": "not_evaluated",
          "capabilityOutcome": "not_evaluated",
          "gateResult": "not_evaluated",
          "reasonCode": "PUBLIC_CAPABILITY_UNAVAILABLE",
          "inputHash": "da432730cb3f3697f6d1cfd9d6cd526089d63dc7478c3ddcae8ace83f0f3cefd",
          "outputHash": "91e75f71c1966f8b205a7233267971356996c3a8f776668560c549dc3820d927",
          "artifactHashes": [],
          "publicOperations": [],
          "humanReview": {
            "status": "pending",
            "rubric": "Review whether 实验设计与混杂 is demonstrated with traceable evidence and an appropriate claim boundary.",
            "reviewer": null,
            "notes": null
          }
        },
        {
          "id": "d05-adversarial",
          "kind": "adversarial",
          "expectedOutcome": "not_evaluated",
          "capabilityOutcome": "not_evaluated",
          "gateResult": "not_evaluated",
          "reasonCode": "PUBLIC_CAPABILITY_UNAVAILABLE",
          "inputHash": "2aac88d91eec2fbae71afbd17fd0e586016d77501307f5d3d851212591aab777",
          "outputHash": "91e75f71c1966f8b205a7233267971356996c3a8f776668560c549dc3820d927",
          "artifactHashes": [],
          "publicOperations": [],
          "humanReview": {
            "status": "pending",
            "rubric": "Review whether 实验设计与混杂 is demonstrated with traceable evidence and an appropriate claim boundary.",
            "reviewer": null,
            "notes": null
          }
        }
      ],
      "machineSummary": "not_evaluated",
      "humanSummary": "pending"
    },
    {
      "id": "06-baseline-execution",
      "title": "baseline 与执行",
      "cases": [
        {
          "id": "d06-success",
          "kind": "success",
          "expectedOutcome": "demonstrated",
          "capabilityOutcome": "demonstrated",
          "gateResult": "pass",
          "reasonCode": "OFFLINE_JOB_SUCCEEDED",
          "inputHash": "557380389a4fd71b3617f47f9414b71ea093952fd92dff04efee2d296f0b1b23",